<!ELEMENT konyvek (konyv*)>
<!ELEMENT konyv (cim,kiadasev,kiado,szerzo+, absztrakt?)>
<!ATTLIST konyv id ID #REQUIRED>
<!ELEMENT cim (#PCDATA)>
<!ELEMENT kiadasev (#PCDATA)>
<!ELEMENT kiado (#PCDATA)>
<!ELEMENT szerzo (#PCDATA)>
<!ELEMENT absztrakt (#PCDATA)>